{
  "audit_event_version": "audit-event.v1",
  "schema_set_version": "2.6.0",
  "canonicalization_version": "canonical-json.v1",
  "audit_event_id": "audit-event-sim-001",
  "occurred_at_utc": "2026-08-24T01:07:00Z",
  "actor_ref": "actor:sim-planner-001",
  "resolved_capability": "edit",
  "auth_policy_version": "simulation-test-policy.v1",
  "environment": "TEST",
  "data_plane": "SIMULATION",
  "synthetic": true,
  "synthetic_provenance": {
    "scenario_id": "SIM-P2-GOLDEN-JSSP-001",
    "scenario_version": "1.0.0",
    "seed": 20260824,
    "factory_profile_id": "PROFILE-P2-XS-001",
    "profile_version": "1.0.0",
    "generator_id": "PLANTNEXUS-P2-CORRECTNESS-ASSEMBLER",
    "generator_version": "1.0.0"
  },
  "action": "EDIT_SCHEDULE",
  "aggregate_type": "SCHEDULE_VERSION",
  "aggregate_id": "schedule-version-sim-001",
  "target": "WORKSPACE_INTERNAL",
  "intent_type": "COMMAND",
  "reason": "Move the synthetic operation for contract replay.",
  "request_fingerprint": "sha256:34fb7bb7c384be4ab60f82616dc701ca89dcc98a127595d7d80d5a518794f89e",
  "idempotency_reference": {
    "scope": "SIMULATION/MOVE_OPERATION/schedule-version-sim-001/WORKSPACE_INTERNAL",
    "key_reference": "sha256:aaaaaaaaaaaaaaaaaaaaaaaaaaaaaaaaaaaaaaaaaaaaaaaaaaaaaaaaaaaaaaaa",
    "request_fingerprint": "sha256:34fb7bb7c384be4ab60f82616dc701ca89dcc98a127595d7d80d5a518794f89e"
  },
  "lineage": null,
  "before_state": "DRAFT",
  "after_state": "DRAFT",
  "source_version": {
    "schedule_version_id": "schedule-version-sim-001",
    "state": "DRAFT",
    "content_fingerprint": "sha256:a04434045794169cf0556ce7c43cf4969aaabfb5a77e4f19e4f8ccd9bbd6e4ac"
  },
  "new_version": {
    "schedule_version_id": "schedule-version-sim-002",
    "state": "DRAFT",
    "content_fingerprint": "sha256:8888888888888888888888888888888888888888888888888888888888888888"
  },
  "export_job_id": null,
  "result": {"outcome": "SUCCEEDED", "replayed": false, "retryable": false, "error": null},
  "correlation_id": "correlation-command-sim-001",
  "parent_audit_event_id": null,
  "code_commit": "a8fcec3383ea0f8d9dca4101056aff37d7eea08c"
}
